{
  "fixture_name": "marmot.transport.nostr.welcome/nip44-extended-length/v1",
  "fixture_version": "1",
  "vector_type": "wire_format",
  "wire": {
    "name": "marmot.transport.nostr.welcome",
    "document": "spec/transports/nostr.md#welcome-delivery"
  },
  "encoding": {
    "format": "NIP-59 gift wrap: a kind 1059 event whose content is a NIP-44 v2 encrypted kind 13 seal, whose content is a NIP-44 v2 encrypted kind 444 Welcome rumor",
    "notes": [
      "nostr_event is the kind 1059 gift wrap exactly as a relay delivers it, addressed to the public key of recipient_secret_key_hex.",
      "recipient_secret_key_hex is sec2 from the NIP-44 test vectors; sec1's public key signs the seal. Both are test keys.",
      "NIP-44 v2 encodes a plaintext of 65,536 bytes or more with a 6-byte length prefix, two zero bytes and then a big-endian u32 length (nostr-protocol/nips#1907). Shorter plaintexts keep the 2-byte u16 prefix.",
      "Both layers take the 6-byte prefix. The seal's plaintext, the rumor JSON, is exactly 65,536 bytes, the shortest plaintext that takes it. The gift wrap's plaintext, the seal JSON, is longer.",
      "The rumor content is the base64 of synthetic Welcome bytes: byte i is i mod 256. They are not a valid MLS Welcome, so the vector covers unwrapping, not joining."
    ]
  },
  "recipient_secret_key_hex": "0000000000000000000000000000000000000000000000000000000000000002",
  "nostr_event": {
    "content": "AqoooQiyB33ZYHeP09Suztw0rJTuf2MFZeX3j1bQR/2MGJgye8xy4wGK60ckeZW0Y6cQd7+vqcDXXOEBXhFOlf9CWWGM21Kc2wvJOVtRHCXA8y9hJoTHyMiVtJTeEu4TkjbOyANMXwbORfzxEMB1deng4h8deH28LGd69f+fSpAqrUTTTacSKyd5/EJVPwUOcVocbKqQeyK4VGdTnlstux8rzgY6fG4serTIuSWgENh8zlAWf+dCcjhRDuiQpxYkzw8qYnnYBRO6um6wFtzOaHRIMyUYIcDXl8dQ/wfIRoWFo88Kjcx+AH5ircRPUuFtHBOInS2eha/Ml0mrYPepEgl9vatXT8Rw+EhzDgvRpGwMSFQUOkwJo+RTC/K0L3gR6Ly7+X2DvgK2iadGa1al2A1LAwP7xyM0wwlAKNl+5AkWPI4rEzkfUGlfU3FC+n7ok5TDR8S4jokeS05SMKi8L+CYe0PrFKM4WwmqdbmoJzqneC7ZLvOAEsA4q7sG4YQpJEo7Sd11KUvcUuXom8F34qAU3X9jP5rTfD2g2h7fJER5M8nXjoNqOTU1IU1VOZMotnPD+cHRMc6EdCvoUQsORfVwnsqX3aGG48DdeFanm+Hvl25yRr9zNoPy3+C+wFmlMiAby7Dn6uZQcfWhHsEh+0Rxn/GTTKGbUc25R19TvQAHuMjsQR8ylC20u6EQp/cC//bo3QciSzl9p5q7DAI7aF9fagPAYhcpfuGEB2vhRI3aCRgKJUrUJosQqKob5IzoyFO1Fwxo0CUGT+loEhocGxPqbLHgCRtZys3RbyeR3v40GVWYMm/JHW24UdroH9lWFYx0e2Im6gG7Ds1l+KxXRhf04zUUP9FyIU2RDf6kSEofXvzvD1NFrjP8eMeS9SQPaNk9Cfal3ZSW1BexAdRDRQrN5+NaFoUagcpRWyW2fJus+ZChr7O6NBzs5r0r2rEDgr5Y489bhVqBAw30dbPISD3tLZZrtlR32H6GiPhbzfkgzsZulFQSC50Y8gYpGo5WZYFQNXZB6RGgXFbqt4yyVPbkQUDsoKZzvPe8ZeWIYC+L859i4axPalyo5eybg/1OMXw0gjL/c3q74akYv0H9hboTY561MumDk1bUDBpGjQ209YIcV7MaUCS0Ny+sLNC2l5clCU/bPnFBbBqDaU5mhTPKH1jibG0HbP6Tq9w0m8KJWdOyKBgjGtWdZO5Fp5SF8sbPPdomCFnRTq0i68JYsbONMDh6P7YAZJOAkxpd+ML1owDEaUlO0O6GpcSNhLjQ2EX/CJ/dJBUOsFMSc93ggGr8qse62KCg+SdjszN+goWCiXp62g2UbnrNrGdrSbbFyhAfSJ14Hy+eg9zQTR3qKa5VYpJ+ZwEoMNP3/PBe2eW0OCbDlhk5Duff0aH9ZvXD9llLwe1RuiIvo26KxQ3nBCBkGn+0JLvpQdXYTk/6nvEtneUIYIYqQKCVgfdK75nnTosYljjoQILWXOqiTFTXqash0B1BiNb5RHGF7n5Jl+2826Fdmz5N5+Y4NjguWQmtLztMhOi1YB2v9o3KKrUJXV5SzC7h/z9k0vQjdWG7+LVDK4KRLFRsVSeOdki+x/f4l3XoggZq7hUlYBZIqpeCxgFL3TuBxXSA4+ybg+kXA0vG7NYmbpeyCJ4x73p8pU5AZSCuLg5AWCJEwot3rkgDDD2yKpX/ZLLZQozFq+Hds3vMXWotXwp9UXZjfJzFXsKH9PmoQrXCR0qfUgFdEQJCUL62at0cRqvuyMk9RK3/DctxK1KYbOF3g8Uy781UujZkqGzlavsUfZnRkmphWvrhZqXhHRWs6vCRlOyuzJ+Eutg08sXJZxDNOvEQJMm6sd8Jhp4AVhtpM0Z26G+MUid2ZPCellzY2pdN3fJNAmKYmHkRZlCG+iQr7DZ7iwOZm4z5/ZcpTzZbYsXjxIr6YH38pqkUGywBknyFL/xi3W/5zkC+ZuhAtXHD7MjWEYy5H6pJhmK+ez4Gykpo/Zks22ss34fsSxyBHRPnmpMyjpT141blD6iVuVM7wHz3WzHNkBpHqdQgQ0k5i7/TgPfS8DQorjLovlB4J5DaGYlQFB+x3oqBypTDC2E5Ton6kG16DchKI0vv+me5e9URwL+WR1e5jV+3lb8KmgN9URlTHvg09AlRyO9tk+diG+Q2TBPiKV9xrJjKMuur+GviJyeMZkVPGsjzX+23zjHcBpLrry7bZAx58zn5uKwSJxnYw/Y7eDuGO4q1eyGCBiw/S7Upp0MfInZ2DuFkytg/NR8vxdhTed+86pB9ZP6hGME2gInvflcdf1JzmAsg+1jb0b7dnpCXU7UONaqHCuHzTgL6EPPpvzwOfjqMKSjnH4QX1Q1bF6RTHsBf47C2uEDJoWA0LyyJIqSkOfvoZ8uU0CdAlhOmF6tNFaKFUbW0fG3nGSbnOSfGuKud25zYs9E5a2uay//TDdANUMNhCf5W/4zREtko5wUwRtrz/mdGcu9WdvVzAiXL4VOvEJJeIC6JFqssxGKZuWHDPVqj4AMliH2LvF6ELIBhVBTMqdzf6GZaRO+jDuM1eGa015ZvQgpT6Jw8BLbnMitJo8hWAIbgmQkyckNA3cjQ1UlHWMXl1ddsZLVtu8U+vKRWU8dyEF57JtiMu3ED1n53yMCOy7GI1+ZFbKNM0iq4U3er2d1KJIANmVFllh+Dvf8kLlHfAUyiyuaviqdRQNmuUSFxWd3t1IwCoDjrODLGLj7DVLrSu2SesZWrtR6Vy+lYoOHaI7SsyPMsfe+ZglPzQwud9QH4BhspVyuBGv+BXO3kfm6RtokcxSZ2CnXOtBat3g59pIP34j9e/1MvJyZapqQSt1Odogs0Mc6cYwd7iDd4sATthaEpF6oNx3begg5FrHR9hIgjtIJTsblH+7AtL+7zegEk3n0krjeyiacwrs5M73dKaJGpKtM1/igog0QROeID+x5jG2xM3QM4yxI3nkH8EJluuPJ5fSuJBhFxNF/zfyhP7yGfV/pGHJBN2SVGYHc1ffoiXhc5tsozXZh5MBJB46rpBq0O5bGOzATCgQ30k19aoYKDIdzMx9CSagQuSXGEd9OsGNS7BdXWSk8QaBOT6Tsvm73VA3zrNj7f2Sg7JfxCmKiwXKcEOwQ3OCV6tKum4V1omFjAdEkYBvTJUEG74hWeWOkPuBzP7TG+f2hrcG1ACmN9n6I46m+QtVy5KGJ3lrGXrQtCdkYCZhkC5S7yYK27kHr38HcQ850KrW2IRVYVW4dWjFpKMfsUubffFMthk88cKpPMhM56n8RQFP2Ouwh/uYGnjolmCH1Pqq0VncFez73EzQgXB5+jTSzE9o7sF+zbLLQwY8X0hCds9lq4Df5ThzCpGxXnsFnTfUMCUM55/fLD0ok5cvyCgc9uxf/IYvF3oeQDBfNo440Fo13krd7yL5v98FtjOePsnH4Y15/jY0xkgV/Ka6t69FgaZLZKnkGPy8AylnYp2jK/J7xkt4COjGaRXXuL/jGh5SLuRxn3gWq3Wiu2AYvvuku5IArVyrcpZy7jvlgYyaXxLSw1oFjPM2kNR9kKInsMPC/QtjUxR/cZ0xPrG0IwBTZ96SQl5qhrvZ4s9wcle5X8ZFQ8icc86jLsYbFIPUM3RFZucGzS3bd6EIeRZ9PzFFN2ncGcmiDL+Sf7lLr/W7HLosoJ+NJnrG7sDSC6g1yOfQdJf6yu9GR1oMc+GVW2k7nJAKHuUY6Yi05qUjdNgw2M8sID91DLckd5gc1JcEKN2EG3dSxQuy5YnKGdokElMymU4baMjYCoRpcI4mP8no61rIKdgBYwzv9GNwBRlowLtGtKJY612ZVUaR5LeCCBcTtFv5xr0GCL+M5MIaeyG84EJXzDWMycXPiUNrqNjy0PxUAVBfB/rUaZpuhT+NKRdi7r3qn+mAaOtMUV/HLUu3Lqbcupk2csPMExi68MuX/gV7gP4yLqUBbpOCgFfA9KDHxhQTtjyJUILM5RATZ5NovozvNhrUo+/CNJG5fW2A3H72pEVuYndrfdRT3RjDFAcgT7XSX/Lgm98YYAahixImZZH7HULrv6p47YdbsUI7bR6mLGxqcAZ2gjgbySndAPhv8YFfmXTrMoIB7xmGSMrsgjhOCJTKcJxhWLm+pi+HUlnGHhKjYIyEs5woAqrPoZ16HsBEOgpsILdR66861nyD5b3msqVysQQrKVaELcsngaSmzgIUCgcj/nz3I941tb562KmBjmSw3HiOqUeM7ayway4mJFkGt5Z/IwpumdXAYCATLx14LZ9Qy5XXdwdUodnqHIZoo12XvNbR7nOlS98986iZT5glQ7bIfqySgG6kbsK8iHDCmM18AGWWnRFmkJRMYhUe2aD7tWDMHA9QiHRAZIMnb4+GzY3cl7O09nwqFIkh0/eOJ1wZsiLky6qUFRQxHCbo5sDCYhW0LKkVVMV6OxhseI3S/K5VF93KCLi8o7TULnsnjuUqkHdrJVc358cIRvqLDclJezusotvC0RD7yS24P4LJUHxq1PZBiaIc1mNATrp0eMnRwmkpr3FJkMVc74G4jkRMKkeqW6KJx5SLHUefcNDUiUj3RuTypPkWh8ot1yST40lvh29j1uaFH2RPbOQc7J8YLMY6QeZi+WB+BcIkobSKDao6o+P8C9xhTvK+u3v+/sRVUKrum4ztl2hbzQbQCnFpBy6XFOuEZegvUIRgptqZaKehFkJXQj5o3abBd3D7iXAXw0d9q/I73us9d/g/FynKDg55AN3Ogb5khfUGHcYmStwsZlTKVEZ5zVcI/azklnCtadjRZTOvO0Ep3ze7ONDQ0yRBPRaobf27q6SZ98m4jB7edB+4lVnlLkX1Kj023HKL8hlBeE2/APC+RPtve0rvrX9PzRDM4rhCaBG2/5Zbx3bkYBr3QpCzD1xj5CcTD2Z3Fviq5CepAOBC0dr5S/15dExM871N330ZDAuDD9oCDezzORBc5DlKz61iz947FRgsMag0DhfgdvBEDp6dZDTfYUAo6Fis4H4gRBvkiYnGV2gB3vZaeBT/CzqfXWntJ4JtFo2fC9Gw9fInlDXCKrTRYOsjs9VwbscYY4z7KUY3387ffpupVX7C1vyYfOHSpkAe6q+PareK7PltFQFNqAn8O+mI8OV8O4jxJEpbDBI7aIGrehYziJZ3+sHbzA+KgmkN2hB1dRFJvdPVNm70ByxTfI9GvJ2bl+A7KPlnaseAqp4IwY3BOALuv0h8kSqiJp4IAOd37+XMettdO/tUULXcI4MGe+c8ArLQEfliNSNuc1YwJcL8MS3paSMSPe3eTJu6EzRfiNrdcfMUmIj/0uWY+0KanD7u+sFILfFIrlWLLNObwKnRSy3/EsMmYzyBukmA061afImpmymuJra0auSfCtMTeJlQsKZFxkQEGUjUozfgTl9thegSUQYjosUwAzXBIU/m4NYFFQUmYLFu46iH1JhDb8OQXUHQbbQN4qcvm5JhzRUZ5NrV4Vprpo9540N43MnZae0Uw4/P6Suw80FMfr73128rAUQK9A7Ym3VGYr7XccEj+12ZlsaXnPAlfjGSiV9m/H9r3ABF5PWCwJrBlXCca8m5eq50IxqVAK0lb8OqAdKpznqY7rtZj6HDRQ7celUrujFv/GDKlkHtaVms5oQYKl+6iDDbeIlOxh45lA6/rQSWlOP11Bt4Jo3FmeoKUeQAah0JtY4WP1KGqVcp269EEYsL0PKHcqElBeZI+zZRaXgXS6apig0j1CrK7XeUVFo2l3kkZE6T8jQWC5D6xXdLldFq0A+/jMLwbWCJ8yFj50ufhrAnyFpGJ3SKN77IOmWq0lXul4t1Cn7s3sUnZLj4EAIyQEmJETFljdnuzsQUpgV922/PALGDSV16sFX4//AVMX+7HBl9nIuhoA1bKAMzPKuWuYXMXjEA6sT3FksxG3cVByj1z4qGrv12giJNVDihEUriliW0i/qelR8FXoB//Fk+wb52jBxt1YS1lspWTY4Qh8sfUEr4AqlsGVunwvGm8GWOomFN7ZQYFMReGSpNil2KEfopJY8AykEqt30A0k2SkawWmC3eLY6JHoDzDpGm0G3tmN0tfCyhmIJpcbkAC8ZkSZbvvVNlHMdqvnfH+yd6pl/xbAozKFiXR0rYaCU7X4BSDGGJjNB7F5CbnKIPS10Dp8ccEBn1e7v7I9px06Oh0bbMEyuY60q73W4s6VzOC7iA/RgfARefrC4iRholtOaGO9LnCDEsRJJ2gkesWpSr31bVJ7UcKd2YKvDpa4aKr0jcKKHhf3NJFOpzExhtc6+Tj7XAm7Z9QcRbUV3Ge7NCmh8xP80fvqBJpHzgGUhE7JUps/TFVY4nnoxAnPdhScZs4f02KQhhL6lsp4ZSrJbW8wvBNq39Osg0Uvv/WWoJrvk9tyqShBfxX+/5qWp/oEpA909a2IHseMbVedEJXocWbEpORYeAnDkhJDnTQE0fdQSI83/Wp1v07ZyitF3Fhv19XbrAw5NjlA2LzyK75En4KujKygwNcAIMF5FsGjGJ3QKdn94Dt3c9w0K71I1/UsQAWi28skrqpK4z1fU04ruhHxW2IGpXINiDW9Vll4v+k4XeeGTaXnXZ5AUDyKgxqlNtNMD0KYhOHDtp/RgKGRd2G71JN3G4zURqjIe7IFX0CS5ELdgqvMEdUyJEgGsk7pKgQdfuFfhdc1NeBFrnj81dnq6C+tdP6W91dCx91PEKHdifOn9d+PpwcubLbgpc5uIp28+DVUM6UFA2V8oRHVoJFRtxvC1k8FmvlRvbolxSus/bV6B7GF3EN8zVNqFOVDOaMRc73+xGDMPF1Se8xhpxftokjG+fxLJVQSnj4oROkQHkk/wVQqjHuTNVk94b8klSC2RtOyzEnJs3N3Ib3eVM/dfJyAjSh6Z+ZWMovpo2BNM8iS/coxVYyJzmTKyLeA5hkht1QSwRvy2ArlUdXKC+jfiOQDmn2fF9NY8pEBuz58o/cucZy8d2Mkz9e8P0zsxTYZYQTLT7L0dHX4aSNwZ4kgSeLTYqKrQrR0/uYCXbmF+A92XIM790HxkzjgUOXd9EfFWk6iT/IPt+W4nKcNO+ep64xYWhYQ9EYwKzYHnv0jiwdRaW2BNBQPWcCKb33nnn+rk+lXEb5I3UySfNiW5Lqv9i2I993cBkmfGSGeNUBEYhBvrgcRuFAOsrTiR5v4zu04yLrAtaGejGq2ZZoR1+zLJzhBlK07LrvRABROsT3waTmozPqPUn2Nenr1CwiyY/1EZpAHymHyV1i9ABURV70517G5dX7xHUszuTiqTW24ugtviWebFPZlnEFTW3ZX+xgAbcQxBi7Sa61xHIRT1AmRzywvfm7Nz+lJXoIxQeZHLMtu5k8AljA5c7wN6DGNPy4s/S5JU18Th/oJf5nwb+pz1u6DLK4+SvaNBfLHBRG+0RzVZWa1qPO/Fj9dZXPMIInr/zGBd/9C36W30m6jjDbqg6fDktUqv1zgVBU4nUNH2eNEU3jLqm5VsrgYOpCEeYPt35acT5x7QDj7BzLwv/XzIe9pZBgF95wNthLWYaihvcxxuZO8EIydp3Nos8BSILx8DYemkf96Nq2PmBDNwKOMyMfuYmac0jA/7778fM5OeF/4B3OihEeXu/I+XBLk17DReipN4KZNNeUDBKUYPlaoSCpCjNwzW2V6OdMEfI3+ApwljowaxLTTm5uReSOdhjofK2U/MlY4yuLFhRD20nncl2nVshxkfyhllOEjrIZ+wtwFgeb7zzPf3q4lq0NLljGjz+bfRdcXg+VRktrINTL8b52nhtdUlvhLQ53YbeQ05BsaPsINK5Qk4HNmrlDRsE7di92rCQjKJyqkrHIl8sdJgFmQ82W8ZriEsoEwQuJz5cMgp6zH90Z7ACnj6ONQom8d8oAGMmU9v6fPMXrm1fipstLtGUaWAaoLHmvhibCUv+mzgXOkM8ahm8NDsNYhLf9BCr6OI+bjcH4YYY3YbwlmzX25pLwxApTyFEIHjwD6Wgi45UxRysysV+RvZz1zUly+BmEM4TF3ApjJ+VMxKeVa28H+wVdGizJHpXUogJpdM9pzRqdvI5FOdz1ge0rHCsgFXkdNbq13/eZNXYaCuV/BmaynsYVJhNq9AyC1SMS++2E0KCm4q3Hr/bMpqBOyng/xt1bQX3ml/0/QQyT9iapJ1dSrJzSUKM3FUFYdAQO+xOLfESmXWr6yEr9DykYjrlwFwvQWWjnTGT/e9++pcwqTV3VTfpaxUpRHKV795HkjPlJCu+RaIgpf8lyoSFvF2aVi6aOekb8AbSf5Wy++d4nUM7vOzJs2/ZbcY9GyJszDfjGe8JFVoh5+ISOMxlrF+Is2QBdwSldPf1KL0p60atu2Y3cffywuLv7iljqDbq5sPRBcsjvlATEJXz04AzHxykvYe2CQwgGpgPuTAAhW3Oyk36zszeBAx/kUhpsz3T5rFZR5K7uaJaev5eVIC32I02y2EkCEzcYJV7udxOJCQyfQKdqYcl7YSoETmL3a+bpS4lPhhx0HMDGtIlCKJ7hGomJTLYLnBZpzUe7IJNU9pi4